track_id,name,album,artist,release_date,length,popularity,key,acousticness,danceability,energy,instrumentalness,liveness,loudness,speechiness,tempo,valence,time_signature,mode,playlist_id,year,decade
7eukWhfJ4WRkRnyeVyAFMs,Ehsaan Tera Hoga Mujh Par,Junglee (Original Motion Picture Soundtrack),Various Artists,1/28/2014,208.986,12,4,0.985,0.38,0.389,0.000602,0.151,-7.241,0.0419,175.505,0.49,4,1,6mx7rVYF6ed2JTMegQ8SY0,2014.0,2010.0
3Jstl9LdDVzYyZwKouZ21W,Chahe Mujhe Koi Junglee Kahe,Junglee (Original Motion Picture Soundtrack),Various Artists,1/28/2014,213.72,12,3,0.925,0.485,0.847,0.0,0.11,-6.312,0.0736,147.565,0.803,4,1,6mx7rVYF6ed2JTMegQ8SY0,2014.0,2010.0
3MrRm2gBu7wUVPcZWKanai,Mera Saaya Saath Hoga,Mera Saaya (Original Motion Picture Soundtrack),Madan Mohan,12/1/1966,363.2,12,2,0.982,0.557,0.422,0.1,0.229,-10.23,0.0285,95.235,0.583,4,1,6mx7rVYF6ed2JTMegQ8SY0,1966.0,1960.0
7wJw4NRtBOXLhgmbxhLAs3,Jhoomka Gira Re,Mera Saaya (Original Motion Picture Soundtrack),Madan Mohan,12/1/1966,296.825,13,8,0.901,0.598,0.787,0.000191,0.812,-4.92,0.16,93.159,0.964,4,1,6mx7rVYF6ed2JTMegQ8SY0,1966.0,1960.0
1kKxvLPfgpG5NRJ9MAmYsu,Lag Ja Gale Se Phir,Woh Kaun Thi? (Original Motion Picture Soundtrack),Madan Mohan,11/1/2013,257.613,37,8,0.796,0.312,0.452,0.000874,0.286,-11.872,0.0391,132.485,0.391,3,1,6mx7rVYF6ed2JTMegQ8SY0,2013.0,2010.0
0tswWwzqhnTAfuqRgfOWS4,Naina Barse Rimjhim Rimjhim,Woh Kaun Thi? (Original Motion Picture Soundtrack),Madan Mohan,11/1/2013,385.131,18,6,0.985,0.437,0.393,0.523,0.16,-8.124,0.0383,129.373,0.256,4,1,6mx7rVYF6ed2JTMegQ8SY0,2013.0,2010.0
1T2gR5wezU89f62bJ5yj1f,Jo Hamne Daastaan Apnee,Woh Kaun Thi? (Original Motion Picture Soundtrack),Madan Mohan,11/1/2013,196.35,12,8,0.981,0.475,0.304,0.0487,0.101,-10.555,0.037,99.474,0.513,4,1,6mx7rVYF6ed2JTMegQ8SY0,2013.0,2010.0
08TF8HbknxGoTA6uk4R8dc,Aawaz Deke Humen Tum Bulao,Professor (Original Motion Picture Soundtrack),Shankar Jaikishan,12/30/1962,194.546,15,3,0.985,0.301,0.326,0.186,0.139,-13.066,0.0405,158.223,0.556,5,0,6mx7rVYF6ed2JTMegQ8SY0,1962.0,1960.0
0riEPsBGr8VT98piKmm2l6,Aye Gulbadan,Professor (Original Motion Picture Soundtrack),Shankar Jaikishan,12/30/1962,200.32,22,8,0.817,0.631,0.403,0.0,0.427,-12.542,0.0376,122.963,0.794,4,0,6mx7rVYF6ed2JTMegQ8SY0,1962.0,1960.0
6PpkGWbKqzgH60818BJF64,Pardesiyon Se Na Ankhiyan Milana - Male Vocals,Jab Jab Phool Khile (Original Motion Picture Soundtrack),Kalyanji-Anandji,10/22/1965,196.56,12,7,0.953,0.463,0.344,0.0592,0.0931,-14.825,0.043,141.575,0.641,4,0,6mx7rVYF6ed2JTMegQ8SY0,1965.0,1960.0
5y1lp6YObOD1dAjj9Qdb0K,Ye Samaa Samaa Hai Pyar Ka,Jab Jab Phool Khile (Original Motion Picture Soundtrack),Kalyanji-Anandji,10/22/1965,286.296,30,5,0.988,0.425,0.449,0.0684,0.0997,-8.754,0.0655,126.553,0.395,4,1,6mx7rVYF6ed2JTMegQ8SY0,1965.0,1960.0
7ofEMQUjM7oue8LQIvRRND,Pardesiyon Se Na Ankhiyan Milana - Happy Version,Jab Jab Phool Khile (Original Motion Picture Soundtrack),Kalyanji-Anandji,10/22/1965,191.506,19,2,0.825,0.517,0.584,3.98e-06,0.625,-9.297,0.0721,80.396,0.744,4,0,6mx7rVYF6ed2JTMegQ8SY0,1965.0,1960.0
2DG0ccrVYIh3qk3ske5jTz,Aaj Phir Jeene Ki Tamanna Hai,Guide (Original Motion Picture Soundtrack),S. D. Burman,12/1/1965,238.266,27,9,0.983,0.433,0.497,0.911,0.101,-10.732,0.0345,97.491,0.782,4,0,6mx7rVYF6ed2JTMegQ8SY0,1965.0,1960.0
2OhvOLNOFPiZKeoyR0pHwm,Tere Mere Sapne Ab Ek Rang Hain (with Dialogues),Guide (Original Motion Picture Soundtrack),S. D. Burman,12/1/1965,266.866,15,3,0.819,0.43,0.472,0.00172,0.42,-11.907,0.0369,87.249,0.592,3,1,6mx7rVYF6ed2JTMegQ8SY0,1965.0,1960.0
5kg0XNporvdIBqQDeqiMY2,Honthon Mein Aisi Baat,Jewel Thief (Original Motion Picture Soundtrack),S. D. Burman,12/30/1967,475.66,22,9,0.905,0.567,0.666,0.247,0.443,-6.888,0.274,111.315,0.795,4,1,6mx7rVYF6ed2JTMegQ8SY0,1967.0,1960.0
3SVvi6aaLccwfsGPRq9eGz,Dil Pukare Aare Aare (with Dialogues),Jewel Thief (Original Motion Picture Soundtrack),S. D. Burman,12/30/1967,440.4,11,10,0.899,0.436,0.328,0.000144,0.104,-13.16,0.157,98.118,0.5,4,1,6mx7rVYF6ed2JTMegQ8SY0,1967.0,1960.0
4yyHoq9H1FGCmvILGJNzMP,Dil Ke Jharokhe Mein,Brahmachari (Original Motion Picture Soundtrack),Shankar Jaikishan,12/1/1967,398.986,27,11,0.892,0.468,0.677,0.774,0.446,-9.047,0.0325,102.944,0.664,4,0,6mx7rVYF6ed2JTMegQ8SY0,1967.0,1960.0
1ckksoSmhxfBE7hk5a9JNn,Aajkal Tere Mere Pyar Ke Charche,Brahmachari (Original Motion Picture Soundtrack),Shankar Jaikishan,12/1/1967,309.493,18,9,0.858,0.556,0.792,0.007,0.596,-10.683,0.0715,98.554,0.776,4,1,6mx7rVYF6ed2JTMegQ8SY0,1967.0,1960.0
56uBWbsLwEznt8QWbI4w3V,Gumnaam Hai Koi Badnaam Hai Koi,Gumnaam (Original Motion Picture Soundtrack),Shankar Jaikishan,12/1/1965,319.082,20,0,0.95,0.396,0.331,0.000281,0.403,-8.087,0.0305,94.803,0.547,4,0,6mx7rVYF6ed2JTMegQ8SY0,1965.0,1960.0
18vpZIyODBUHa1OIS1L5Hi,Tumne Pukara Aur Hum Chale Aaye,Raj Kumar (Original Motion Picture Soundtrack),Shankar Jaikishan,12/30/1964,326.333,19,8,0.969,0.379,0.399,0.00197,0.386,-10.707,0.0417,95.231,0.547,4,1,6mx7rVYF6ed2JTMegQ8SY0,1964.0,1960.0
1H0Emv03XFvyMaLY0NqnUg,Is Rang Badalti Duniya Mein,Raj Kumar (Original Motion Picture Soundtrack),Shankar Jaikishan,12/30/1964,273.12,14,7,0.976,0.459,0.339,0.0126,0.365,-7.485,0.0632,97.591,0.616,4,1,6mx7rVYF6ed2JTMegQ8SY0,1964.0,1960.0
7b6QWFFhvSSKeE38zixIrd,Mere Samnewali Khidki Mein,Padosan (Original Motion Picture Soundtrack),R. D. Burman,12/1/1967,172.173,28,7,0.839,0.705,0.591,0.000476,0.0968,-9.549,0.217,139.782,0.768,4,0,6mx7rVYF6ed2JTMegQ8SY0,1967.0,1960.0
47oE1sGVKBgdYNSjLRrYxU,Chup Gaye Sare Nazare,Do Raaste (Original Motion Picture Soundtrack),Laxmikant–Pyarelal,12/30/1969,329.274,32,3,0.956,0.414,0.548,0.038,0.119,-9.1,0.0936,80.407,0.586,4,0,6mx7rVYF6ed2JTMegQ8SY0,1969.0,1960.0
0Is8MSBOFmkzxQrev3xYu0,Bindiya Chamke Gi,Do Raaste (Original Motion Picture Soundtrack),Laxmikant–Pyarelal,12/30/1969,346.47,20,7,0.99,0.635,0.437,0.0813,0.0672,-8.297,0.0623,82.032,0.688,4,0,6mx7rVYF6ed2JTMegQ8SY0,1969.0,1960.0
1KKusvyZyBmrYTuk9YR0Nk,Jab Chali Thandi Hawa,Do Badan (Original Motion Picture Soundtrack),Ravi,12/1/1966,232.146,16,8,0.954,0.554,0.414,0.00035,0.177,-10.179,0.0523,127.415,0.818,4,1,6mx7rVYF6ed2JTMegQ8SY0,1966.0,1960.0
3sSdq6VX6iwv8VEkbC0AvV,Khai Hai Re Ham Ne Qasam,Talash (Original Motion Picture Soundtrack),S. D. Burman,1/1/1969,250.666,10,3,0.983,0.482,0.391,0.00286,0.215,-10.555,0.0506,112.982,0.714,4,1,6mx7rVYF6ed2JTMegQ8SY0,1969.0,1960.0
5DhWbhLe66cqWxJzxDvh7L,Aaj Ki Junli Raat Ma,Talash (Original Motion Picture Soundtrack),S. D. Burman,1/1/1969,419.173,10,7,0.847,0.5,0.561,1.07e-05,0.123,-10.984,0.0986,106.779,0.813,4,1,6mx7rVYF6ed2JTMegQ8SY0,1969.0,1960.0
3V4xJQuAip7DMc1Q49fnMN,Palkon Ke Peechhe Se,Talash (Original Motion Picture Soundtrack),S. D. Burman,1/1/1969,283.466,15,5,0.968,0.627,0.45,0.271,0.107,-9.208,0.0314,95.042,0.798,3,1,6mx7rVYF6ed2JTMegQ8SY0,1969.0,1960.0
6J8f9R7iv3XiUdznTTRgx5,Bedardi Balma Tujhko,Arzoo (Original Motion Picture Soundtrack),Shankar Jaikishan,9/3/1965,299.253,14,6,0.932,0.436,0.382,0.00296,0.365,-9.253,0.0313,99.051,0.513,4,1,6mx7rVYF6ed2JTMegQ8SY0,1965.0,1960.0
0NMHJgkmn6heDuxpL2brXX,Chaudhvin Ka Chand Ho,Chaudhvin Ka Chand (Original Motion Picture Soundtrack),Ravi,12/1/1960,223.506,26,7,0.899,0.524,0.28,0.0,0.144,-7.078,0.0289,97.694,0.525,4,1,6mx7rVYF6ed2JTMegQ8SY0,1960.0,1960.0
31FumhpEaNtbMrXsMEhQTP,"Jo Wada Kiya Woh Nibhana Padega, Pt. 1",Taj Mahal (Original Motion Picture Soundtrack),Roshan,12/1/1963,192.773,19,11,0.682,0.344,0.621,0.00018,0.546,-5.074,0.0306,78.899,0.556,4,0,6mx7rVYF6ed2JTMegQ8SY0,1963.0,1960.0
3GxbpFBnqWSd9dwDai2dwU,Mere Mehboob Tujhe Meri Muhabbat - Male Vocals,Mere Mehboob (Original Motion Picture Soundtrack),Naushad,12/1/1963,420.391,17,8,0.995,0.479,0.291,0.585,0.103,-12.714,0.0319,74.568,0.434,3,1,6mx7rVYF6ed2JTMegQ8SY0,1963.0,1960.0
64hNcjAFDYbM9dBVpZ3Sdc,Taarif Karoon Kya Uski,Kashmir Ki Kali (Original Motion Picture Soundtrack),O. P. Nayyar,12/30/1964,326.666,18,6,0.811,0.601,0.46,0.0,0.526,-12.047,0.0477,109.346,0.831,4,0,6mx7rVYF6ed2JTMegQ8SY0,1964.0,1960.0
0s9Rh73nBce2twJtTLGz1P,Diwana Hua Badal,Kashmir Ki Kali (Original Motion Picture Soundtrack),O. P. Nayyar,12/30/1964,356.893,29,8,0.895,0.482,0.356,1.78e-06,0.195,-11.877,0.0294,99.729,0.541,4,1,6mx7rVYF6ed2JTMegQ8SY0,1964.0,1960.0
5tyfgN9FzDLu7DhV3Xmems,Lal Chhadi Maidan Khadi,Janwar (Original Motion Picture Soundtrack),Shankar Jaikishan,12/1/1965,254.094,11,5,0.795,0.501,0.731,0.0,0.836,-5.26,0.105,149.656,0.837,4,0,6mx7rVYF6ed2JTMegQ8SY0,1965.0,1960.0
6T5n738bh0xqem6Sdp3RFE,Tumse Achchha Kaun Hai,Janwar (Original Motion Picture Soundtrack),Shankar Jaikishan,12/1/1965,219.0,25,7,0.916,0.533,0.686,8.28e-06,0.465,-11.861,0.0396,147.349,0.942,4,1,6mx7rVYF6ed2JTMegQ8SY0,1965.0,1960.0
0rJDrdHIaSZEqtgb3scub6,Akele Akele Kahan Ja Rahe Ho,An Evening in Paris (Original Motion Picture Soundtrack),Shankar Jaikishan,12/1/1967,285.48,24,1,0.796,0.398,0.599,0.012,0.293,-9.128,0.0375,50.262,0.608,4,1,6mx7rVYF6ed2JTMegQ8SY0,1967.0,1960.0
78ZHTbiQUFzvJHV2Vxw9bz,"Badan Pe Sitare Lapete Huye (From ""Prince"")",Memoirically - Mohammed Rafi,Mohammed Rafi,4/24/2018,288.16,32,9,0.702,0.456,0.686,0.0043,0.211,-9.07,0.0969,99.649,0.77,4,1,6mx7rVYF6ed2JTMegQ8SY0,2018.0,2010.0
1XYJHPrROELfAecWedkhCe,O Mere Sona Re Sona,Teesri Manzil (Original Motion Picture Soundtrack),R. D. Burman,12/31/1966,300.088,32,3,0.915,0.676,0.551,0.0,0.294,-6.586,0.0814,108.82,0.907,4,1,6mx7rVYF6ed2JTMegQ8SY0,1966.0,1960.0
4so9JgcGs2o2YMnb4jqUWU,O Haseena Zulfonwale Jane Jahan,Teesri Manzil (Original Motion Picture Soundtrack),R. D. Burman,12/31/1966,415.236,17,0,0.681,0.387,0.649,5.57e-06,0.3,-5.197,0.0571,92.682,0.779,4,1,6mx7rVYF6ed2JTMegQ8SY0,1966.0,1960.0
3hYK9VisrrkT6ctDcHdu3e,Aaja Aaja Main Hoon Pyar Tera,Teesri Manzil (Original Motion Picture Soundtrack),R. D. Burman,12/31/1966,401.16,22,4,0.823,0.482,0.59,0.057,0.394,-13.831,0.143,112.685,0.772,4,1,6mx7rVYF6ed2JTMegQ8SY0,1966.0,1960.0
5NufGwz095agtMV3wAI62y,Aaja Piya Tohe Pyar Doon,Baharon Ke Sapne (Original Motion Picture Soundtrack),R. D. Burman,12/30/1967,251.414,12,7,0.978,0.603,0.29,6.34e-05,0.0991,-6.897,0.0545,110.34,0.581,4,1,6mx7rVYF6ed2JTMegQ8SY0,1967.0,1960.0
7kq7GSLlgBiWIY74h3euB9,Saathiya Nahin Jana,Aya Sawan Jhoom Ke (Original Motion Picture Soundtrack),Laxmikant–Pyarelal,12/1/1969,269.0,19,7,0.902,0.42,0.637,0.00213,0.208,-5.876,0.0702,156.319,0.814,4,1,6mx7rVYF6ed2JTMegQ8SY0,1969.0,1960.0
2QduffmP1CwjJ6kAA5hkUk,"Likhe Jo Khat Tujhe (From ""Kanyadaan"")",Memoirically - Mohammed Rafi,Mohammed Rafi,4/24/2018,273.533,41,11,0.89,0.37,0.45,0.14,0.326,-13.439,0.0338,106.629,0.745,4,0,6mx7rVYF6ed2JTMegQ8SY0,2018.0,2010.0
1zS4QQSbzkkdxXvrsiCpL9,Pardesiyon Se Na Ankhiyan Milana - Female Vocals,Jab Jab Phool Khile (Original Motion Picture Soundtrack),Kalyanji-Anandji,10/22/1965,197.868,10,2,0.975,0.369,0.523,0.716,0.13,-6.895,0.0912,163.505,0.419,4,0,6mx7rVYF6ed2JTMegQ8SY0,1965.0,1960.0
3RM9QK09MCBbThpyBP8aYB,Woh Bhooli Dastan Lo Phir Yaad,Sanjog (Original Motion Picture Soundtrack),Madan Mohan,12/31/1961,292.013,6,9,0.984,0.457,0.378,0.0433,0.212,-11.327,0.0423,125.727,0.454,4,1,6mx7rVYF6ed2JTMegQ8SY0,1961.0,1960.0
5B9I49diHU1gvikeUmF8AH,Teri Aankhon Ke Siva - Female Vocals,Chirag (Original Motion Picture Soundtrack),Madan Mohan,12/1/1969,265.066,12,8,0.985,0.331,0.418,0.00284,0.37,-12.007,0.0352,147.059,0.638,3,1,6mx7rVYF6ed2JTMegQ8SY0,1969.0,1960.0
5jLLoCldTG8bsynJWI7jJT,"Dil Ka Bhanwar Kare Pukar (From ""Tere Ghar Ke Samne"")",Memoirically - Mohammed Rafi,Mohammed Rafi,4/24/2018,199.119,28,6,0.922,0.384,0.416,6.99e-06,0.281,-9.033,0.0449,155.158,0.721,3,1,6mx7rVYF6ed2JTMegQ8SY0,2018.0,2010.0
70s7eNRRO25LSMi4Ix903S,Chale The Saath Milkar,Hasina Maan Jaayegi (Original Motion Picture Soundtrack),Kalyanji-Anandji,12/1/1968,203.826,15,9,0.975,0.585,0.29,0.0474,0.181,-13.607,0.0343,116.217,0.785,4,0,6mx7rVYF6ed2JTMegQ8SY0,1968.0,1960.0
4vqhlfzud2HfdAtz7stS22,Bekhudi Mein Sanam,Hasina Maan Jaayegi (Original Motion Picture Soundtrack),Kalyanji-Anandji,12/1/1968,330.448,19,4,0.913,0.424,0.566,0.00387,0.0722,-7.392,0.0641,83.619,0.262,4,0,6mx7rVYF6ed2JTMegQ8SY0,1968.0,1960.0
1fTJIGK6BkARUxrqk9EzrJ,Zindagi Bhar Nahi Bhoolegi,Barsaat Ki Raat (Original Motion Picture Soundtrack),Roshan,1/1/1960,245.487,16,0,0.978,0.683,0.301,0.837,0.0912,-12.853,0.0514,111.796,0.633,4,1,6mx7rVYF6ed2JTMegQ8SY0,1960.0,1960.0
1O5qA3XSUP6Kxn0eeSJls4,Ajib Dastan Hai Yeh,Dil Apna Aur Preet Parai (Original Motion Picture Soundtrack),Shankar Jaikishan,12/31/1960,315.613,28,5,0.875,0.566,0.412,0.00314,0.204,-12.63,0.0309,102.478,0.679,4,1,6mx7rVYF6ed2JTMegQ8SY0,1960.0,1960.0
7KoJExPLSJNymJRSDR56UF,"Aap Ki Nazron Ne Samjha (From ""Anpadh"")",Masterworks Lata Mangeshkar,Lata Mangeshkar,4/25/2018,234.893,37,4,0.816,0.339,0.373,0.0,0.61,-9.576,0.0409,174.094,0.583,1,0,6mx7rVYF6ed2JTMegQ8SY0,2018.0,2010.0
7vBURRSR4klz0ITXs1YBWY,Aya Sawan Jhoom Ke,Aya Sawan Jhoom Ke (Original Motion Picture Soundtrack),Laxmikant–Pyarelal,12/1/1969,414.981,15,1,0.747,0.451,0.807,0.00378,0.0945,-4.829,0.0761,92.02,0.711,4,1,6mx7rVYF6ed2JTMegQ8SY0,1969.0,1960.0
2Dt8XxTjzv8OfM96nZWnY6,Jaiye Aap Kahan Jayenge,Mere Sanam (Original Motion Picture Soundtrack),O. P. Nayyar,12/26/1965,383.746,20,0,0.839,0.525,0.538,0.0,0.224,-8.137,0.0272,105.197,0.59,4,0,6mx7rVYF6ed2JTMegQ8SY0,1965.0,1960.0
6U9TxZgPueOqKvFTlyo1ke,Chalo Sajna Jhahan Tak,Mere Hamdam Mere Dost (Original Motion Picture Soundtrack),Laxmikant–Pyarelal,12/1/1968,296.413,10,9,0.917,0.368,0.504,0.00367,0.196,-11.743,0.0542,153.011,0.534,4,1,6mx7rVYF6ed2JTMegQ8SY0,1968.0,1960.0
1ekvpHbNKELfHq8q6x7OO1,"Koi Hamdam Na Raha (From ""Jhumroo"")",One Man Many Roles - Kishore Kumar,Kishore Kumar,6/6/2018,204.233,9,2,0.815,0.476,0.452,0.0259,0.21,-6.667,0.0327,81.731,0.261,4,1,6mx7rVYF6ed2JTMegQ8SY0,2018.0,2010.0
5e7FlIZMy1ndoNPewGZSu5,Aage Bhi Jane Na Tu,Waqt,Ravi,7/28/1965,445.027,42,3,0.98,0.509,0.276,0.0045,0.0805,-6.934,0.0278,76.126,0.541,4,1,3dKv6gpADy34FI6rcP7DAT,1965.0,1960.0
2TOXCqdsGqHt8oRuDkJBCW,Aaja Aai Bahar,Raj Kumar,Shankar Jaikishan,10/20/1964,334.61,27,1,0.969,0.387,0.628,0.203,0.421,-6.186,0.0491,82.145,0.635,4,0,3dKv6gpADy34FI6rcP7DAT,1964.0,1960.0
03HZm1iCO3y8GTFv7yobL3,Aajkal Tere Mere Pyar Ke Charche,Brahmachari,Various Artists,1/1/1968,309.493,43,9,0.858,0.555,0.792,0.0072,0.596,-10.683,0.0721,98.634,0.776,4,1,3dKv6gpADy34FI6rcP7DAT,1968.0,1960.0
1P278K5LuPJOatR1wBUywC,Aane Se Uske Aaye Bahar,Jeene Ki Raah,Laxmikant–Pyarelal,1/1/1969,247.613,51,6,0.886,0.37,0.412,0.00297,0.0869,-14.738,0.036,95.448,0.668,4,0,3dKv6gpADy34FI6rcP7DAT,1969.0,1960.0
11IpCZVWahQVaRNoNX5WbF,Aap Ki Nazron Ne Samjha,Anpadh,Madan Mohan,1/1/1961,234.893,47,4,0.818,0.339,0.373,0.0,0.61,-9.576,0.0409,173.743,0.583,1,0,3dKv6gpADy34FI6rcP7DAT,1961.0,1960.0
1TF5j2GV0gJ5CBYmJxmaLk,Ab Tumhare Hawale Vatan Sathiyon,Haqeeqat,Madan Mohan,1/1/1964,366.48,24,5,0.764,0.316,0.541,0.0,0.0583,-11.647,0.0425,86.016,0.452,4,0,3dKv6gpADy34FI6rcP7DAT,1964.0,1960.0
0C47mkZ7VGcnKBvEG7PiAP,Abhi Na Jao Chhod Kar,Hum Dono,Jaidev,1/1/1961,255.026,56,3,0.607,0.521,0.421,0.187,0.329,-9.856,0.0355,96.444,0.551,3,1,3dKv6gpADy34FI6rcP7DAT,1961.0,1960.0
6u3ZEin2KdyVsb7uD3R0u7,Ae Phoolon Ki Rani,Arzoo,Shankar Jaikishan,1/1/1965,258.093,31,4,0.873,0.371,0.359,0.00415,0.362,-14.451,0.0704,149.339,0.657,3,1,3dKv6gpADy34FI6rcP7DAT,1965.0,1960.0
747CNc1O5GyHxjuMX5wpMh,Andaz Mera Mastana,Dil Apna Aur Preet Parai,Shankar Jaikishan,1/1/1960,402.226,14,4,0.843,0.476,0.516,0.000815,0.232,-8.868,0.129,87.717,0.662,4,0,3dKv6gpADy34FI6rcP7DAT,1960.0,1960.0
6xCnMMPkIIhn3QyGJgd5xd,Ae Mere Zohra Jabeen,Waqt,Ravi,7/28/1965,235.333,52,6,0.984,0.441,0.463,0.151,0.0993,-11.476,0.0742,79.582,0.514,3,0,3dKv6gpADy34FI6rcP7DAT,1965.0,1960.0
3hEDNbJiTytsPjKULzd12O,Badan Pe Sitare Lapete Huye,Prince,Shankar Jaikishan,1/1/1969,288.16,36,9,0.704,0.457,0.686,0.00431,0.211,-9.07,0.0973,99.809,0.777,4,1,3dKv6gpADy34FI6rcP7DAT,1969.0,1960.0
06WBL2qDIabVl2Q1gpNvOa,Baharo Phool Barsao,Suraj,Various Artists,3/25/1966,267.771,45,3,0.885,0.283,0.545,0.0309,0.101,-8.573,0.0389,168.452,0.62,4,0,3dKv6gpADy34FI6rcP7DAT,1966.0,1960.0
34kav8CJjcM52QVsOPGioz,Baar Baar Dekho Hazar Baar Dekho,China Town,Ravi,1/1/1962,291.306,26,7,0.938,0.529,0.525,0.00502,0.117,-8.379,0.06,146.732,0.875,4,1,3dKv6gpADy34FI6rcP7DAT,1962.0,1960.0
5pK0vczjjtEctAvp4EFz7p,Bedardi Balma Tujhko,Arzoo,Shankar Jaikishan,1/1/1965,299.253,26,6,0.932,0.436,0.382,0.00285,0.365,-9.253,0.0313,99.052,0.513,4,1,3dKv6gpADy34FI6rcP7DAT,1965.0,1960.0
7ukboFFuDuxKWRdxahmth7,Beqarar Karke Hamen Yun Na Jaiye,Bees Saal Baad,Hemant Kumar,1/1/1962,189.88,51,10,0.971,0.653,0.446,0.251,0.621,-11.823,0.0483,113.465,0.757,4,0,3dKv6gpADy34FI6rcP7DAT,1962.0,1960.0
4CNUwJcKDYePzsAKwLGFBE,Bekhudi Mein Sanam,Hasina Maan Jayegi,Kalyanji-Anandji,1/1/1968,330.448,32,4,0.913,0.429,0.566,0.00389,0.0722,-7.392,0.0635,83.626,0.263,4,0,3dKv6gpADy34FI6rcP7DAT,1968.0,1960.0
6zZs6U5nQ3UELVUmeIV6hp,Bindiya Chamke Gi,Do Raaste,Laxmikant–Pyarelal,12/5/1969,346.47,36,2,0.99,0.6,0.445,0.0785,0.0672,-8.297,0.0627,81.77,0.681,4,0,3dKv6gpADy34FI6rcP7DAT,1969.0,1960.0
4R30QrFrzeJAIGUMERL7lf,Bol Gori Bol Tera Kaun Piya,Milan,Laxmikant–Pyarelal,1/1/1967,274.0,17,2,0.876,0.595,0.581,0.0037,0.708,-12.324,0.605,109.913,0.956,4,1,3dKv6gpADy34FI6rcP7DAT,1967.0,1960.0
4nEKA1qrppgDexxV25EvKs,Chaudhvin Ka Chand Ho,Chaudhvin Ka Chand,Ravi,1/1/1960,223.506,47,7,0.899,0.524,0.28,0.0,0.144,-7.078,0.0289,97.691,0.525,4,1,3dKv6gpADy34FI6rcP7DAT,1960.0,1960.0
6DuEwqeZzkPJlczCKPq1VD,Chup Gaye Sare Nazare,Do Raaste,Laxmikant–Pyarelal,12/5/1969,329.274,51,3,0.956,0.395,0.547,0.0395,0.119,-9.1,0.0931,80.219,0.588,4,0,3dKv6gpADy34FI6rcP7DAT,1969.0,1960.0
6f9eWUzhm2nWnvWJvMIoH8,Itni Badi Mehfil,Dil Apna Aur Preet Parai,Shankar Jaikishan,1/1/1960,289.426,11,10,0.788,0.548,0.571,2.56e-06,0.35,-8.128,0.141,146.72,0.88,4,1,3dKv6gpADy34FI6rcP7DAT,1960.0,1960.0
6bqomnA0eZT99DkRJ7O3Ed,Dil Ke Jharokhe Mein,Brahmachari,Various Artists,1/1/1968,398.986,41,11,0.892,0.472,0.677,0.77,0.484,-9.049,0.0327,102.515,0.662,4,0,3dKv6gpADy34FI6rcP7DAT,1968.0,1960.0
74HMSKb0oi3Qu5p2himHFP,Dooriyan Nazdikiyan Ban Gayi,Duniya,Shankar Jaikishan,12/28/1968,302.625,21,4,0.88,0.545,0.74,0.0445,0.369,-5.944,0.0744,127.622,0.728,4,1,3dKv6gpADy34FI6rcP7DAT,1968.0,1960.0
1KCZN33CNIcnBhtfYZfmt8,Gumnaam Hai Koi Badnaam Hai Koi,Gumnaam,Shankar Jaikishan,2/6/1965,319.082,30,0,0.95,0.395,0.331,0.00029,0.403,-8.086,0.0305,94.804,0.547,4,0,3dKv6gpADy34FI6rcP7DAT,1965.0,1960.0
2rHxwYzdn66nDMmDmmio6W,Ham Tere Pyar Mein,Dil Ek Mandir,Shankar Jaikishan,1/1/1963,286.866,19,3,0.949,0.446,0.359,6.69e-05,0.304,-8.081,0.0515,178.417,0.842,3,1,3dKv6gpADy34FI6rcP7DAT,1963.0,1960.0
4J246KfYVmbkUjFrIjw3NM,Haule Haule Chalo Mere Sajna,Sawan Ki Ghata,O. P. Nayyar,1/1/1966,259.36,23,8,0.942,0.791,0.49,5.74e-06,0.191,-9.487,0.04,108.314,0.911,4,1,3dKv6gpADy34FI6rcP7DAT,1966.0,1960.0
4cnArdofPnnUYLGbHA5m8R,Jis Desh Men Ganga Behti Hai,Revival Vol.14 - Dil Deke Dekho,Various Artists,5/20/2000,274.06,11,4,0.988,0.409,0.36,0.734,0.223,-15.671,0.0433,115.273,0.72,3,0,3dKv6gpADy34FI6rcP7DAT,2000.0,2000.0
1AlatlIkROgLvG6pgBBnAz,Roop Tera Mastana,Aradhana,S. D. Burman,9/27/1969,225.213,55,8,0.666,0.449,0.53,7.3e-06,0.234,-8.787,0.0951,83.362,0.543,4,0,3dKv6gpADy34FI6rcP7DAT,1969.0,1960.0
2UsoLrNUuElVmdfolaW0FM,Baghon Mein Bahar Hai,Aradhana,S. D. Burman,9/27/1969,232.0,36,10,0.914,0.657,0.422,1.94e-05,0.15,-10.219,0.102,82.432,0.903,4,1,3dKv6gpADy34FI6rcP7DAT,1969.0,1960.0
3HvFwWWPtB3jBvpyzlpJo5,Chanda Hai Tu Mera Suraj Hai Tu,Aradhana,S. D. Burman,9/27/1969,242.506,37,5,0.974,0.551,0.323,0.000824,0.142,-12.014,0.051,150.311,0.87,3,1,3dKv6gpADy34FI6rcP7DAT,1969.0,1960.0
098jYib9xwJFe6W4eIL5Ok,Mere Sapnon Ki Rani,Aradhana,S. D. Burman,9/27/1969,300.64,47,8,0.921,0.514,0.532,0.000114,0.333,-12.57,0.046,119.194,0.772,4,1,3dKv6gpADy34FI6rcP7DAT,1969.0,1960.0
61QOwSMaYXkI9xZg1sHeL0,Kora Kagaz Tha Yeh Man Mera,Aradhana,S. D. Burman,9/27/1969,338.796,46,5,0.918,0.316,0.5,0.00686,0.149,-7.557,0.0532,199.178,0.679,3,1,3dKv6gpADy34FI6rcP7DAT,1969.0,1960.0
01pFIqE0PM4o7GPOMqQyFg,Dost Dost Na Raha Pyar Pyar Na Raha,Sangam,Various Artists,1/1/1964,346.28,37,2,0.99,0.353,0.329,0.405,0.468,-11.501,0.0315,86.161,0.528,3,0,3dKv6gpADy34FI6rcP7DAT,1964.0,1960.0
10hFhXP0zj8YqEbjHnp2d5,Yeh Mera Prem Patra,Sangam,Various Artists,1/1/1964,265.146,41,2,0.98,0.501,0.281,0.728,0.181,-12.376,0.0393,116.806,0.433,4,1,3dKv6gpADy34FI6rcP7DAT,1964.0,1960.0
1vfKOtQEtsxzDoq6uXKy4y,Main Kya Karoon Ram,Sangam,Various Artists,1/1/1964,225.186,22,7,0.968,0.689,0.302,0.0977,0.482,-13.269,0.175,115.882,0.917,4,0,3dKv6gpADy34FI6rcP7DAT,1964.0,1960.0
5SOz11mekUwr7kQm8dpHqs,Aaj Phir Jeene Ki Tamanna Hai,Guide,S. D. Burman,12/6/1965,238.266,38,9,0.983,0.432,0.497,0.907,0.101,-10.732,0.0345,97.491,0.783,4,0,3dKv6gpADy34FI6rcP7DAT,1965.0,1960.0
02994S7mqoSbgW1DwuDY9K,Kya Se Kya Ho Gaya Bewafa,Guide,S. D. Burman,12/6/1965,196.013,41,6,0.852,0.417,0.402,0.00357,0.0856,-13.759,0.0368,94.622,0.743,4,1,3dKv6gpADy34FI6rcP7DAT,1965.0,1960.0
6yoT89zUSra0wzS1DKFC1w,Piya Tose Naina Laage Re,Guide,S. D. Burman,12/6/1965,509.466,39,4,0.907,0.438,0.449,0.127,0.179,-10.066,0.0439,129.037,0.608,3,1,3dKv6gpADy34FI6rcP7DAT,1965.0,1960.0
5fQnotlNe1TaQzcuw2V3IG,Wahan Kaun Hai Tera Musafir,Guide,S. D. Burman,12/6/1965,283.36,40,6,0.983,0.456,0.264,0.343,0.118,-13.787,0.0318,94.352,0.694,3,1,3dKv6gpADy34FI6rcP7DAT,1965.0,1960.0
2veL3jD5JTNM0Mu9HtAyNk,Neele Gagan Ke Tale,Hamraaz,Ravi,10/16/1967,212.044,44,6,0.986,0.568,0.397,0.0205,0.111,-8.536,0.0272,108.535,0.535,4,1,3dKv6gpADy34FI6rcP7DAT,1967.0,1960.0
1kcgh8BXTRWyKG7YHmhkIW,Tum Agar Saath Dene Ka Vada Karo,Hamraaz,Ravi,10/16/1967,391.066,50,11,0.915,0.414,0.336,0.0026,0.118,-10.792,0.0363,149.238,0.533,4,1,3dKv6gpADy34FI6rcP7DAT,1967.0,1960.0
6xoPnrn51jW3MYk7DqI0XY,Kisi Patthar Ki Murat Se,Hamraaz,Ravi,10/16/1967,277.653,36,6,0.93,0.787,0.434,0.0,0.0987,-8.431,0.115,121.905,0.571,4,0,3dKv6gpADy34FI6rcP7DAT,1967.0,1960.0
0V550MTYlDCBGqO3lcQfzj,Koi Jab Raha - Meri Dosti Mera Pyar,Dosti,Laxmikant–Pyarelal,1/1/1964,259.825,32,0,0.958,0.483,0.562,0.00228,0.263,-8.585,0.033,95.511,0.846,4,0,3dKv6gpADy34FI6rcP7DAT,1964.0,1960.0
6SCf99mxhYS51dxk8R25o4,Raahi Manwa Dukh Ki Chinta,Dosti,Laxmikant–Pyarelal,1/1/1964,245.066,32,1,0.989,0.48,0.311,0.0479,0.137,-15.814,0.0986,80.967,0.674,4,1,3dKv6gpADy34FI6rcP7DAT,1964.0,1960.0
7gt47MyVDtpPi8nyo0Ga4t,Mera To Jo Bhi Kadam,Dosti,Laxmikant–Pyarelal,1/1/1964,227.172,27,8,0.991,0.365,0.32,0.00953,0.247,-8.798,0.0327,106.957,0.318,4,1,3dKv6gpADy34FI6rcP7DAT,1964.0,1960.0
5qEIp2fPaHJHiXxV7VQZCU,Hum Tum Yug Yug Se,Milan,Laxmikant–Pyarelal,1/1/1967,337.04,32,9,0.889,0.441,0.51,0.0032,0.0812,-10.993,0.0636,106.947,0.616,4,0,3dKv6gpADy34FI6rcP7DAT,1967.0,1960.0
54Ll8fbLlxj6HlnBCpcoXN,Insaaf Ki Dagar Pe,Gunga Jumna,Naushad,1/1/1961,196.969,23,3,0.906,0.616,0.534,0.0,0.0989,-8.732,0.04,139.265,0.702,3,1,3dKv6gpADy34FI6rcP7DAT,1961.0,1960.0
1xNN6c8eW8Mm9uz9nVqln9,Isharon Isharon Men Dil Lenewale,Kashmir Ki Kali,O. P. Nayyar,1/1/1964,290.4,48,5,0.964,0.439,0.447,0.00213,0.136,-7.341,0.0413,137.156,0.56,4,1,3dKv6gpADy34FI6rcP7DAT,1964.0,1960.0
5wyh6qOrkJKvpwMG3Uw1TH,Jaiye Aap Kahan Jayenge,Classic Revival Jiya Beqarar Hai,Various Artists,7/22/1999,404.626,14,0,0.693,0.506,0.679,8.7e-06,0.325,-8.61,0.0491,105.266,0.566,4,0,3dKv6gpADy34FI6rcP7DAT,1999.0,1990.0
5tSprRSXVb3rMpeKZLk3Ak,Jhumka Gira Re Live,Asha And R.D Burman Live-Royal Albert - Vol-1,Traditional,1/2/2002,259.2,8,0,0.54,0.375,0.771,5.62e-06,0.443,-7.917,0.0743,86.929,0.718,4,1,3dKv6gpADy34FI6rcP7DAT,2002.0,2000.0
4MbatWSKrUNttg8wnb1gnV,Jo Wada Kiya Woh Nibhana Padega - Happy,Taj Mahal,Roshan,1/1/1963,195.8,44,8,0.972,0.453,0.396,0.786,0.253,-11.499,0.045,158.131,0.596,4,0,3dKv6gpADy34FI6rcP7DAT,1963.0,1960.0
3k3323reCuiNkcszxw1xIC,Kashmir Ki Kali Hoon Main,Junglee,Shankar Jaikishan,1/1/1961,209.149,34,11,0.854,0.415,0.825,0.00014,0.385,-6.311,0.16,170.026,0.942,4,1,3dKv6gpADy34FI6rcP7DAT,1961.0,1960.0
17dlQo59kOe5F5ajiiMGpY,Kasme Wade Pyar Wafa,Upkar,Kalyanji-Anandji,1/1/1968,208.927,44,0,0.93,0.374,0.309,0.000763,0.182,-11.437,0.0318,91.735,0.39,4,1,3dKv6gpADy34FI6rcP7DAT,1968.0,1960.0
4jDfPSa6zoZ4xGTSmyrg8i,Khoya Khoya Chand Khula Aasman,Kala Bazar,S. D. Burman,1/1/1960,280.08,32,9,0.749,0.503,0.549,1.66e-05,0.508,-7.436,0.0347,81.369,0.742,4,1,3dKv6gpADy34FI6rcP7DAT,1960.0,1960.0
6u5CSldnNwH0n9uwUUQfeX,Lakhon Hain Nigahon Mein,Phir Wohi Dil Laya Hoon,O. P. Nayyar,1/1/1963,258.12,27,0,0.594,0.675,0.522,0.0,0.138,-12.664,0.0405,115.77,0.884,4,1,3dKv6gpADy34FI6rcP7DAT,1963.0,1960.0
0es02Rp0p0WpC4WRBDtM8P,Likhe Jo Khat Tujhe,Kanyadaan,Shankar Jaikishan,1/1/1968,273.533,57,11,0.89,0.375,0.449,0.139,0.326,-13.439,0.0337,106.603,0.744,4,0,3dKv6gpADy34FI6rcP7DAT,1968.0,1960.0
4cAor2NTIbU8wKB981HtBe,Main Gaoon Tum So Jao - Sad,Brahmachari,Various Artists,1/1/1968,292.866,15,2,0.465,0.387,0.416,0.427,0.18,-13.57,0.037,115.312,0.56,4,0,3dKv6gpADy34FI6rcP7DAT,1968.0,1960.0
3P4PWapqyGglDdXD4fMukT,Main Pyar Ka Rahi Hoon,Ek Musafir Ek Hasina,Various Artists,1/1/1962,197.617,18,1,0.966,0.697,0.336,1.06e-05,0.108,-8.839,0.0383,116.201,0.673,4,0,3dKv6gpADy34FI6rcP7DAT,1962.0,1960.0
6WuqZZMPq8veUt0PbPoUFc,Mast Baharon Ka Main Aashiq,Farz,Laxmikant–Pyarelal,1/1/1967,380.317,16,7,0.932,0.366,0.622,0.0101,0.41,-8.425,0.052,92.266,0.68,4,0,3dKv6gpADy34FI6rcP7DAT,1967.0,1960.0
2YbrPbCH4tCSRvnnl9mpAX,Mera Saaya Saath Hoga,Mera Saaya,Madan Mohan,1/1/1966,363.2,30,2,0.982,0.548,0.422,0.102,0.229,-10.23,0.029,95.372,0.585,4,1,3dKv6gpADy34FI6rcP7DAT,1966.0,1960.0
4dOuRzk99XX9ET0HYFcH5h,Mera Yaar Bana Hain Dulha,Chaudhvin Ka Chand,Ravi,1/1/1960,212.733,9,7,0.962,0.475,0.499,0.0886,0.25,-12.751,0.149,89.516,0.861,4,1,3dKv6gpADy34FI6rcP7DAT,1960.0,1960.0
1XS996vY5m20pTjU99UI6Z,Mere Mehboob Tujhe Meri Muhabbat,Mere Mehboob,Naushad,1/1/1963,420.391,26,8,0.995,0.478,0.291,0.582,0.103,-12.714,0.0319,74.618,0.433,3,1,3dKv6gpADy34FI6rcP7DAT,1963.0,1960.0
